"https://www.squareone.ca/resource-centres/condo-owner/condos-vs-apartments","text/html; charset=UTF-8","200","OK","Indexable","","Condos vs. Apartments | Differences, Costs, Pros + Cons | Square One","68","621","Learn about the differences between an apartment and a condo. We'll cover the definitions, the cost differences, plus common pros + cons of each.","145","903","","0","Condos vs. apartments: what’s the difference?","45","","0","Condos vs. apartments","21","Cost differences","16","index, follow, max-image-preview:large, max-snippet:-1, max-video-preview:-1","","","https://www.squareone.ca/resource-centres/condo-owner/condos-vs-apartments","","","","","","73192","1417","213","6.653","70.406","Fairly Easy","12.459","2","","15","11","0","4.200","47","35","0","8","8","0","","","","","22834c53708d28dc04e05362a96aa673","1.422","","","","","1.1","https://www.squareone.ca/resource-centres/condo-owner/condos-vs-apartments","2023-05-24 14:53:50"
"https://www.squareone.ca/resource-centres/home-improvement/how-an-hvac-zoning-system-makes-a-more-comfortable-home","text/html; charset=UTF-8","200","OK","Indexable","","How an HVAC System Makes a More Comfortable Home | Square One","61","623","Wondering if an HVAC zoning system will improve the comfort of your home? Learn how HVAC zone systems are planned and how it can save you money in the long-run.","160","1040","","0","How an HVAC zoning system makes a more comfortable home","55","","0","Zoned HVAC systems explained","28","Planning your zones","19","index, follow, max-image-preview:large, max-snippet:-1, max-video-preview:-1","","","https://www.squareone.ca/resource-centres/home-improvement/how-an-hvac-zoning-system-makes-a-more-comfortable-home","","","","","","74527","1281","166","7.717","69.362","Normal","11.230","2","","5","2","0","0.760","43","34","0","6","6","0","","","","","edfe4529c94853e50660810efd6bbf4c","1.028","","","","","1.1","https://www.squareone.ca/resource-centres/home-improvement/how-an-hvac-zoning-system-makes-a-more-comfortable-home","2023-05-24 14:53:51"
"https://www.squareone.ca/about-us/experts/rena-novotny","text/html; charset=UTF-8","200","OK","Indexable","","Rena Novotny | Square One","25","242","Rena started her career as a telephone adjuster at Commercial Union Assurance in 1981. She has 23 years of experience as an independent adjuster specializing in complex and high conflict claims. In March 2016, Rena joined Square One Insurance Services as Claims Manager.","270","1698","","0","Rena Novotny","12","","0","Professional experience","23","Educational background","22","index, follow, max-image-preview:large, max-snippet:-1, max-video-preview:-1","","","https://www.squareone.ca/about-us/experts/rena-novotny","","","","","","84871","1513","195","7.759","53.859","Fairly Hard","12.231","2","","17","17","0","6.490","46","42","0","22","22","0","","","","","96474ca60051994ce83d8fb6262c3cef","0.815","","","","","1.1","https://www.squareone.ca/about-us/experts/rena-novotny","2023-05-24 14:53:51"
"https://www.squareone.ca/sales/images/heros/hero-about-us.png","image/png","200","OK","Indexable","","","0","0","","0","0","","0","","0","","0","","0","","0","","","","","","","","","","0","0","","","","","0.000","2","","0","0","0","0.000","0","0","0","0","0","0","","","","","","0.030","Wed, 19 Apr 2023 02:39:42 GMT","","","","1.1","https://www.squareone.ca/sales/images/heros/hero-about-us.png","2023-05-24 14:53:52"
"https://www.squareone.ca/goose","text/html; charset=UTF-8","200","OK","Indexable","","Goose and Square One | Travel, Life, and Health Insurance","57","516","Square One has partnered with Goose to bring you best-in-class insurance policies for life, travel, income protection, kids, and more. Get all these coverages in minutes with the Goose mobile app.","196","1191","","0","Getting life, travel, and health insurance just got a lot easier","64","","0","Travel insurance","16","Income protection insurance","27","index, follow, max-image-preview:large, max-snippet:-1, max-video-preview:-1","","","https://www.squareone.ca/goose","","","","","","55980","602","93","6.473","64.090","Normal","7.988","2","","9","2","0","0.760","33","25","0","17","8","0","","","","","4af5002bc537571c0525c00b8ca6b041","0.788","","","","","1.1","https://www.squareone.ca/goose","2023-05-24 14:53:52"
"https://www.squareone.ca/city-not-listed","text/html; charset=UTF-8","200","OK","Indexable","","City Not Listed | Square One","28","250","Looking to get a home insurance quote from Square One? Learn how to determine if we've launched in your city.","109","688","","0","Was your city not listed?","25","","0","Get a personalized home insurance quote from $12/month","54","Visit our homepage","18","index, follow, max-image-preview:large, max-snippet:-1, max-video-preview:-1","","","https://www.squareone.ca/city-not-listed","","","","","","48706","190","30","6.333","73.507","Fairly Easy","3.777","2","","1","1","0","0.380","28","24","0","4","4","0","","","","","4860d32810f2cd9c49272b8c5fd73641","1.302","","","","","1.1","https://www.squareone.ca/city-not-listed","2023-05-24 14:53:52"
"https://www.squareone.ca/sales/images/icons/icon-people.svg","image/svg+xml","200","OK","Indexable","","","0","0","","0","0","","0","","0","","0","","0","","0","","","","","","","","","","1855","0","","","","","0.000","2","","0","0","0","0.000","0","0","0","0","0","0","","","","","","0.024","Wed, 19 Apr 2023 02:39:44 GMT","","","","1.1","https://www.squareone.ca/sales/images/icons/icon-people.svg","2023-05-24 14:53:53"
"https://www.squareone.ca/resource-centres/home-personal-safety/enjoying-christmas-trees-safely","text/html; charset=UTF-8","200","OK","Indexable","","Christmas Trees | Fire Prevention and Decoration Safety Tips | Square One","73","663","Learn how to prevent Christmas tree related fires that could damage your home and ruin your holidays, as well as other safety tips to consider when decorating the tree.","168","1034","","0","Enjoying Christmas trees safely","31","","0","Before you buy a Christmas tree","31","Live Christmas tree safety tips","31","index, follow, max-image-preview:large, max-snippet:-1, max-video-preview:-1","","","https://www.squareone.ca/resource-centres/home-personal-safety/enjoying-christmas-trees-safely","","","","","","83392","1954","241","8.108","85.603","Easy","13.837","2","","14","9","0","3.440","53","40","0","7","7","0","","","","","61a5e4fe9816cc06c00b5beb728b2e24","0.922","","","","","1.1","https://www.squareone.ca/resource-centres/home-personal-safety/enjoying-christmas-trees-safely","2023-05-24 14:53:52"
"https://www.squareone.ca/home/alberta/edmonton","text/html; charset=UTF-8","200","OK","Indexable","","Home Insurance In Edmonton From $12/Month | Square One","54","537","Buy home insurance in Edmonton for as little as $12/month. Get a free online home insurance quote in 5 minutes from Square One.","127","806","","0","Edmonton home insurance from $12/month","38","","0","Get an online home insurance quote in 5 minutes.","48","home insurance customers love and trust","39","index, follow, max-image-preview:large, max-snippet:-1, max-video-preview:-1","","","https://www.squareone.ca/home/alberta/edmonton","","","","","","109964","2950","450","6.556","75.203","Fairly Easy","16.224","2","","7","2","0","0.760","47","35","0","31","31","0","","","","","dc8aec874682561e083b791cd8959612","2.189","","","","","1.1","https://www.squareone.ca/home/alberta/edmonton","2023-05-24 14:53:51"
"https://www.squareone.ca/resource-centres/home-personal-safety/avoiding-accidents-in-your-home","text/html; charset=UTF-8","200","OK","Indexable","","Avoiding Accidents in Your Home | Falls, Cuts, Burns and More | Square One","74","671","Accidents are always prone to happen around the home. Learn the common ones and how to prevent injury with tips for falls, cuts, burns and more.","144","909","","0","Avoiding accidents in your home","31","","0","Poisons","7","Burns","5","index, follow, max-image-preview:large, max-snippet:-1, max-video-preview:-1","","","https://www.squareone.ca/resource-centres/home-personal-safety/avoiding-accidents-in-your-home","","","","","","68484","995","138","7.210","75.295","Fairly Easy","9.393","2","","15","11","0","4.200","50","38","0","6","6","0","","","","","df5b4f4d916139f6ce6975d4f0802657","1.630","","","","","1.1","https://www.squareone.ca/resource-centres/home-personal-safety/avoiding-accidents-in-your-home","2023-05-24 14:53:52"
"https://www.squareone.ca/sales/images/icons/icon-rental.svg","image/svg+xml","200","OK","Indexable","","","0","0","","0","0","","0","","0","","0","","0","","0","","","","","","","","","","3953","0","","","","","0.000","2","","0","0","0","0.000","0","0","0","0","0","0","","","","","","0.029","Wed, 19 Apr 2023 02:39:51 GMT","","","","1.1","https://www.squareone.ca/sales/images/icons/icon-rental.svg","2023-05-24 14:53:54"
"https://www.squareone.ca/sales/images/icons/icon-one-contact.svg","image/svg+xml","200","OK","Indexable","","","0","0","","0","0","","0","","0","","0","","0","","0","","","","","","","","","","2057","0","","","","","0.000","2","","0","0","0","0.000","0","0","0","0","0","0","","","","","","0.021","Wed, 19 Apr 2023 02:39:49 GMT","","","","1.1","https://www.squareone.ca/sales/images/icons/icon-one-contact.svg","2023-05-24 14:53:54"
"https://www.squareone.ca/resource-centres/insurance-basics/home-insurance-checklist","text/html; charset=UTF-8","200","OK","Indexable","","Home Insurance Checklist | Types, Coverages, Tips and More | Square One","71","660","Your home can be one of the largest and most important assets you own. To protect your investment from the unexpected, it's important to take the time to choose the right protection. Learn more with this checklist from Square One.","230","1430","","0","Home insurance checklist","24","","0","Common types of home insurance policies","39","Important aspects to review in your insurance policy","52","index, follow, max-image-preview:large, max-snippet:-1, max-video-preview:-1","","","https://www.squareone.ca/resource-centres/insurance-basics/home-insurance-checklist","","","","","","71125","1273","166","7.669","54.906","Fairly Hard","12.228","2","","9","8","0","3.050","53","44","0","4","4","0","","","","","85845eb036d46af1547c4c370bab63b7","0.849","","","","","1.1","https://www.squareone.ca/resource-centres/insurance-basics/home-insurance-checklist","2023-05-24 14:53:53"
"https://www.squareone.ca/resource-centres/insurance-basics/choosing-the-right-deductible","text/html; charset=UTF-8","200","OK","Indexable","","Home Insurance Deductibles | How They Work, Types and More | Square One","71","680","Wondering about insurance deductibles? Learn about how deductibles work, the different options you have to choose from and how they affect your insurance premium for your home or tenant insurance.","196","1255","","0","What is a deductible and what options are available?","52","","0","How do deductibles work?","24","The different types of deductibles","34","index, follow, max-image-preview:large, max-snippet:-1, max-video-preview:-1","","","https://www.squareone.ca/resource-centres/insurance-basics/choosing-the-right-deductible","","","","","","77009","1237","173","7.150","53.630","Fairly Hard","11.285","2","","23","20","0","7.630","49","40","0","5","5","0","","","","","b5e0f310d0f3a486a445fcd33626a602","1.743","","","","","1.1","https://www.squareone.ca/resource-centres/insurance-basics/choosing-the-right-deductible","2023-05-24 14:53:53"
"https://www.squareone.ca/resource-centres/home-personal-safety/preparing-for-rainy-weather","text/html; charset=UTF-8","200","OK","Indexable","","Preparing for Rainy Weather and Minimizing Flood Damage | Square One","68","645","Learn the top tips to prevent water damage during Canada's rainy and wet winter season. Also, learn how to avoid a flooded basement and insurance considerations if there is a flood or water damage.","197","1233","","0","Preparing for rainy weather and minimizing flood damage","55","","0","Preparing for rain","18","Preparing for flood damage","26","index, follow, max-image-preview:large, max-snippet:-1, max-video-preview:-1","","","https://www.squareone.ca/resource-centres/home-personal-safety/preparing-for-rainy-weather","","","","","","82923","2071","267","7.757","73.512","Fairly Easy","15.372","2","","6","3","0","1.150","56","46","0","6","6","0","","","","","84674a24f1ddbfb40ca4673d21ef6b2d","1.031","","","","","1.1","https://www.squareone.ca/resource-centres/home-personal-safety/preparing-for-rainy-weather","2023-05-24 14:53:54"
"https://www.squareone.ca/resource-centres/home-personal-safety/fire-escape-ladders-guide-for-your-home","text/html; charset=UTF-8","200","OK","Indexable","","Fire Escape Ladders | How To Use, Tips, Features and More | Square One","70","645","Knowing how to use a fire escape ladder can be the difference between you and your family getting out of a house fire safely. Learn how to use a fire escape ladder, what you need to consider when purchasing, features to know about and other considerations.","256","1593","","0","Fire escape ladders guide for your home","39","","0","Escape ladders explained","24","Key features for home fire escape ladders","41","index, follow, max-image-preview:large, max-snippet:-1, max-video-preview:-1","","","https://www.squareone.ca/resource-centres/home-personal-safety/fire-escape-ladders-guide-for-your-home","","","","","","71199","1210","167","7.246","80.132","Easy","10.673","2","","16","9","0","3.440","44","35","0","6","6","0","","","","","6280be8de846d25d40acd69437339c1","1.077","","","","","1.1","https://www.squareone.ca/resource-centres/home-personal-safety/fire-escape-ladders-guide-for-your-home","2023-05-24 14:53:54"
"https://www.squareone.ca/house/aluminum-wiring","text/html; charset=UTF-8","200","OK","Indexable","","Aluminum Wiring Insurance For About $75/Month - Square One","58","561","For about $75/month, you can get insurance for houses with aluminum wiring. Get an online quote in 5 minutes or call 1.855.331.6933 to speak with a licensed agent.","163","1023","","0","Insurance for houses with aluminum wiring","41","","0","Get an online house insurance quote in 5 minutes.","49","house insurance customers love and trust","40","index, follow, max-image-preview:large, max-snippet:-1, max-video-preview:-1","","","https://www.squareone.ca/house/aluminum-wiring","","","","","","89104","1659","267","6.213","80.385","Easy","11.479","2","","3","3","0","1.150","36","31","0","4","4","0","","","","","f7aafcff6668d6ac779f4f13596a077b","2.282","","","","","1.1","https://www.squareone.ca/house/aluminum-wiring","2023-05-24 14:53:53"
"https://www.squareone.ca/home/bc/burnaby","text/html; charset=UTF-8","200","OK","Indexable","","Home Insurance In Burnaby From $12/Month | Square One","53","518","Buy condo insurance in Burnaby from $40/month. Get a free online condo insurance quote in 5 minutes from Square One.","116","749","","0","Burnaby home insurance from $12/month","37","","0","Get an online home insurance quote in 5 minutes.","48","home insurance customers love and trust","39","index, follow, max-image-preview:large, max-snippet:-1, max-video-preview:-1","","","https://www.squareone.ca/home/bc/burnaby","","","","","","88333","1672","264","6.333","79.376","Fairly Easy","11.723","2","","2","2","0","0.760","39","33","0","4","4","0","","","","","30cef53f316c987d6c50708d41255ff5","1.495","","","","","1.1","https://www.squareone.ca/home/bc/burnaby","2023-05-24 14:53:54"
"https://www.squareone.ca/my-future-home","text/html; charset=UTF-8","200","OK","Indexable","","The My Future Home Drawing Contest [+$3,000 in Prizes] | Square One","67","626","As schools partially reopen and summer vacation closes in, children may have some extra time on their hands. So, we’ve launched a children’s drawing contest where the winners will receive an RESP contribution of up to $1,500.","225","1394","","0","My Future Home Contest","22","","0","About","5","How to enter","12","index, follow, max-image-preview:large, max-snippet:-1, max-video-preview:-1","","","https://www.squareone.ca/my-future-home","","","","","","50129","350","59","5.932","83.824","Easy","5.514","2","","6","2","0","0.760","36","27","0","4","4","0","","","","","69dfd63afb15d23217c2b8b2a092db6e","1.301","","","","","1.1","https://www.squareone.ca/my-future-home","2023-05-24 14:53:55"
"https://www.squareone.ca/resource-centres/insurance-basics/types-of-insurance","text/html; charset=UTF-8","200","OK","Indexable","","Types of Insurance | Square One","31","287","While Square One focuses on home insurance, use this resource to find information about all the types of insurance available in the marketplace.","144","887","","0","What types of insurance are available?","38","","0","Life insurance","14","Travel insurance","16","index, follow, max-image-preview:large, max-snippet:-1, max-video-preview:-1","","","https://www.squareone.ca/resource-centres/insurance-basics/types-of-insurance","","","","","","53819","504","79","6.380","58.520","Fairly Hard","7.100","2","","7","2","0","0.760","39","27","0","4","4","0","","","","","582aadb839ad21774958bc82114bd2ee","1.641","","","","","1.1","https://www.squareone.ca/resource-centres/insurance-basics/types-of-insurance","2023-05-24 14:53:56"
"https://www.squareone.ca/fire","text/html; charset=UTF-8","200","OK","Indexable","","Fire Insurance From $12/Month | Square One","42","400","For as little as $12/month, you can get fire insurance from Square One. Get a free online quote now or call 1.855.331.6933.","123","756","","0","fire insurance from $12/month","29","","0","Get an online fire insurance quote in 5 minutes.","48","fire insurance customers love and trust","39","index, follow, max-image-preview:large, max-snippet:-1, max-video-preview:-1","","","https://www.squareone.ca/fire","","","","","","87591","1668","267","6.247","81.506","Easy","11.654","2","","17","17","0","6.490","36","31","0","4","4","0","","","","","666df1031d1ae5b31d325ff0138cfeea","2.594","","","","","1.1","https://www.squareone.ca/fire","2023-05-24 14:53:55"
"https://www.squareone.ca/sales/images/icons/icon-shield_blue.svg","image/svg+xml","200","OK","Indexable","","","0","0","","0","0","","0","","0","","0","","0","","0","","","","","","","","","","1606","0","","","","","0.000","2","","0","0","0","0.000","0","0","0","0","0","0","","","","","","0.023","Wed, 19 Apr 2023 02:39:52 GMT","","","","1.1","https://www.squareone.ca/sales/images/icons/icon-shield_blue.svg","2023-05-24 14:53:58"
"https://www.squareone.ca/resource-centres/home-improvement/how-to-choose-the-right-swimming-pool-for-your-family","text/html; charset=UTF-8","200","OK","Indexable","","Choosing The Right Pool | Design, Location, Material and More | Square One","74","671","Learn how to choose the right swimming pool for your family. From the location in your backyard to what material will be optimal for your budget and family, this swimming pool guide will help you make the correct decision. Also discover what design suits your home best.","270","1666","","0","How to choose the right swimming pool for your family","53","","0","In ground or above ground?","26","Pool materials – quick guide","28","index, follow, max-image-preview:large, max-snippet:-1, max-video-preview:-1","","","https://www.squareone.ca/resource-centres/home-improvement/how-to-choose-the-right-swimming-pool-for-your-family","","","","","","69830","1109","157","7.064","79.745","Fairly Easy","9.919","2","","6","3","0","1.150","47","38","0","6","6","0","","","","","17c02961336be710affebdb4532c830c","1.749","","","","","1.1","https://www.squareone.ca/resource-centres/home-improvement/how-to-choose-the-right-swimming-pool-for-your-family","2023-05-24 14:53:56"
"https://www.squareone.ca/sales/images/icons/icon-arrow-down.svg","image/svg+xml","200","OK","Indexable","","","0","0","","0","0","","0","","0","","0","","0","","0","","","","","","","","","","216","0","","","","","0.000","2","","0","0","0","0.000","0","0","0","0","0","0","","","","","","0.021","Wed, 19 Apr 2023 02:39:47 GMT","","","","1.1","https://www.squareone.ca/sales/images/icons/icon-arrow-down.svg","2023-05-24 14:53:58"
"https://www.squareone.ca/renters","text/html; charset=UTF-8","200","OK","Non-Indexable","noindex","Renters Insurance from $12/Month | Square One","45","431","For as little as $12/month, you can get personalized renters insurance from Square One. Get an online quote in 5 minutes or call 1.855.331.6933 to speak with a licensed agent.","175","1080","","0","Get a renters insurance quote for as little as $12/month","56","","0","The best way to protect the things you love","43","Six reasons why you’ll love Square One","38","noindex, follow","","","","","","","","","97716","2668","414","6.444","68.194","Normal","17.389","2","","4","3","0","1.150","42","37","0","4","4","0","","","","","154b9a1e9c1cd521746101b156c511f1","2.363","","","","","1.1","https://www.squareone.ca/renters","2023-05-24 14:53:57"
"https://www.squareone.ca/resource-centres/insurance-basics/mice-damage","text/html; charset=UTF-8","200","OK","Indexable","","Mice Damage | Insurance, Coverage, What To Do and More | Square One","67","640","Mice and other rodents can cause a lot of unexpected damage to your home. Learn if home insurance provides protection against property damage cause by mice, raccoons, and other animals and insects.","197","1258","","0","Does home insurance cover damage from mice?","43","","0","Does home insurance cover mouse damage or the cost of extermination?","68","How do I prevent damage from mice?","34","index, follow, max-image-preview:large, max-snippet:-1, max-video-preview:-1","","","https://www.squareone.ca/resource-centres/insurance-basics/mice-damage","","","","","","69586","996","145","6.869","68.716","Normal","9.585","2","","14","13","0","4.960","42","35","0","6","6","0","","","","","5d2846c209de97f89c55575a45aa255b","1.423","","","","","1.1","https://www.squareone.ca/resource-centres/insurance-basics/mice-damage","2023-05-24 14:53:58"
"https://www.squareone.ca/contents/students","text/html; charset=UTF-8","200","OK","Indexable","","Contents Insurance For Students - Square One","44","412","For as little as $12/month, college and university students can get contents insurance from Square One. Get an online quote in 5 minutes or call 1.855.331.6933 to speak with a licensed agent.","191","1177","","0","Get a contents insurance quote for as little as $12/month","57","","0","Contents insurance that students love and trust","47","Six reasons why you'll love Square One","38","index, follow, max-image-preview:large, max-snippet:-1, max-video-preview:-1","","","https://www.squareone.ca/contents/students","","","","","","96519","2562","393","6.519","68.266","Normal","16.870","2","","4","3","0","1.150","42","37","0","4","4","0","","","","","8dcf8d268816f4cb015f1344c60ea818","1.794","","","","","1.1","https://www.squareone.ca/contents/students","2023-05-24 14:53:58"
"https://www.squareone.ca/tenant/bc","text/html; charset=UTF-8","200","OK","Indexable","","Tenant Insurance In BC From $12/Month | Square One","50","480","Buy tenant and renters insurance in BC for as little as $12/month. Get a free online tenant insurance quote in 5 minutes from Square One.","137","845","","0","BC tenant insurance from $12/month","34","","0","Get an online tenant insurance quote in 5 minutes.","50","tenant insurance customers love and trust","41","index, follow, max-image-preview:large, max-snippet:-1, max-video-preview:-1","","","https://www.squareone.ca/tenant/bc","","","","","","109394","3026","460","6.578","77.480","Fairly Easy","16.608","2","","7","2","0","0.760","44","33","0","28","28","0","","","","","c6f4d586ec25ea699e88dffd722506a5","2.663","","","","","1.1","https://www.squareone.ca/tenant/bc","2023-05-24 14:53:58"
"https://www.squareone.ca/sales/images/icons/icon-semi.svg","image/svg+xml","200","OK","Indexable","","","0","0","","0","0","","0","","0","","0","","0","","0","","","","","","","","","","2072","0","","","","","0.000","2","","0","0","0","0.000","0","0","0","0","0","0","","","","","","0.027","Wed, 19 Apr 2023 02:39:43 GMT","","","","1.1","https://www.squareone.ca/sales/images/icons/icon-semi.svg","2023-05-24 14:54:01"
"https://www.squareone.ca/resource-centres/condo-owner/condo-boards","text/html; charset=UTF-8","200","OK","Indexable","","Condo Boards | Roles + Responsibilities | Square One","52","468","Learn all about condo boards (a.k.a. strata councils), including their roles, responsibilities, powers, and how they work.","122","729","","0","Condo board roles and responsibilities","38","","0","What is a condo board?","22","How much power does a condo board have?","39","index, follow, max-image-preview:large, max-snippet:-1, max-video-preview:-1","","","https://www.squareone.ca/resource-centres/condo-owner/condo-boards","","","","","","87609","1635","228","7.171","66.473","Normal","12.215","2","","18","12","0","4.580","44","33","0","11","11","0","","","","","6784548ec4c0312a495ad37869ec6cf4","1.784","","","","","1.1","https://www.squareone.ca/resource-centres/condo-owner/condo-boards","2023-05-24 14:54:00"
