"https://www.squareone.ca/renewing-a-policy","text/html; charset=UTF-8","200","OK","Indexable","","Renewing a Policy | Square One","30","280","Learn how your policy automatically renews and what you expect during the process. Also, read how Square One can solve your most common concerns.","145","944","","0","Renewing your home or tenant insurance policy","45","","0","Enjoy comprehensive protection","30","Enjoy rate-capping benefits","27","index, follow, max-image-preview:large, max-snippet:-1, max-video-preview:-1","","","https://www.squareone.ca/renewing-a-policy","","","","","","51949","619","82","7.549","62.364","Normal","8.586","2","","1","1","0","0.380","28","25","0","4","4","0","","","","","969085ea8d7ae944e68779c4c3dc5a7d","1.579","","","","","1.1","https://www.squareone.ca/renewing-a-policy","2023-05-24 14:53:21"
"https://www.squareone.ca/home/identity-theft","text/html; charset=UTF-8","200","OK","Indexable","","Identity Theft Insurance | Square One","37","330","You can get identity theft insurance from Square One that starts at $1.67/month. Get an online quote now or call 1.855.331.6933.","128","802","","0","Identity theft insurance","24","","0","","0","","0","index, follow, max-image-preview:large, max-snippet:-1, max-video-preview:-1","","","https://www.squareone.ca/home/identity-theft","","","","","","78809","1439","225","6.396","77.000","Fairly Easy","11.381","2","","5","5","0","1.910","35","30","0","4","4","0","","","","","1a3f1cf8d800d82787fe93f050176b4f","1.464","","","","","1.1","https://www.squareone.ca/home/identity-theft","2023-05-24 14:53:22"
"https://www.squareone.ca/resource-centres/home-improvement/your-hvac-noise-guide-what-do-all-those-noises-mean","text/html; charset=UTF-8","200","OK","Indexable","","Home HVAC Noise Guide | Ducts, Furnaces, and Conditioners | Square One","70","661","HVAC systems, air conditioners, furnaces and home duct systems can all make strange noises. Learn if these noises require professional attention or what you can do to prevent them.","180","1127","","0","Your home HVAC noise guide: What do all those noises mean?","58","","0","HVAC noises demystified","23","Duct noises","11","index, follow, max-image-preview:large, max-snippet:-1, max-video-preview:-1","","","https://www.squareone.ca/resource-centres/home-improvement/your-hvac-noise-guide-what-do-all-those-noises-mean","","","","","","82706","2065","277","7.455","75.257","Fairly Easy","15.672","2","","6","3","0","1.150","47","36","0","8","8","0","","","","","e24522b9f58212aaac18565fe65c7104","1.180","","","","","1.1","https://www.squareone.ca/resource-centres/home-improvement/your-hvac-noise-guide-what-do-all-those-noises-mean","2023-05-24 14:53:23"
"https://www.squareone.ca/semi-attached-house","text/html; charset=UTF-8","200","OK","Indexable","","Semi-Attached House (Duplex) Insurance | Square One","51","486","For as little as $40/month, you can get semi-attached house (duplex) insurance from Square One. Get a free online quote now or call 1.855.331.6933.","147","920","","0","Get an online semi-attached house insurance quote in 5 minutes.","63","","0","Semi-attached house insurance for about $75/month","49","Policies for condo titled homes from $40/month","46","index, follow, max-image-preview:large, max-snippet:-1, max-video-preview:-1","","","https://www.squareone.ca/semi-attached-house","","","","","","51654","364","47","7.745","64.869","Normal","5.738","2","","5","5","0","1.910","37","34","0","4","4","0","","","","","86dfa21e9ddc64aa425acbbdd5e2e3d1","0.623","","","","","1.1","https://www.squareone.ca/semi-attached-house","2023-05-24 14:53:24"
"https://www.squareone.ca/resource-centres/insurance-basics/insuring-new-possessions","text/html; charset=UTF-8","200","OK","Indexable","","Completing a Home Inventory + Insuring New Possessions | Square One","67","638","Learn how you can insure new possessions and items you buy or get as gifts. You'll also learn the importance of completing a home inventory and how to do it properly.","166","1030","","0","Completing a home inventory","27","","0","Why you need a household inventory","34","How to complete a household inventory","37","index, follow, max-image-preview:large, max-snippet:-1, max-video-preview:-1","","","https://www.squareone.ca/resource-centres/insurance-basics/insuring-new-possessions","","","","","","82361","1690","211","8.009","65.448","Normal","12.982","2","","23","17","0","6.490","53","40","0","9","9","0","","","","","7b29dbe4794592f7399125f220bb20a","2.675","","","","","1.1","https://www.squareone.ca/resource-centres/insurance-basics/insuring-new-possessions","2023-05-24 14:53:22"
"https://www.squareone.ca/resource-centres/landlord/signing-ending-a-residential-lease","text/html; charset=UTF-8","200","OK","Indexable","","Signing and Ending Residential Tenancy Agreements | Square One","62","587","Learn about residential tenancy agreements and how they relate to landlords and tenants. Also, learn the actions you are required to take if you want to end a tenancy term early and access other helpful landlord related resources.","230","1410","","0","Signing and ending a residential lease","38","","0","Month-to-month vs. fixed-term leases","36","More on fixed-term leases","25","index, follow, max-image-preview:large, max-snippet:-1, max-video-preview:-1","","","https://www.squareone.ca/resource-centres/landlord/signing-ending-a-residential-lease","","","","","","87666","2025","261","7.759","73.460","Fairly Easy","14.269","2","","9","4","0","1.530","47","35","0","15","14","0","","","","","484fbb251ad054476e30f1ce9913230","3.249","","","","","1.1","https://www.squareone.ca/resource-centres/landlord/signing-ending-a-residential-lease","2023-05-24 14:53:22"
"https://www.squareone.ca/resource-centres/home-personal-safety/after-a-water-backup","text/html; charset=UTF-8","200","OK","Indexable","","What To Do After a Sewer Backup Occurs In Your Home | Square One","64","613","Learn what you need to do after a water or sewer backup occurs in your home and you how you clean and restore your property back to its original state.","151","942","","0","What to do after a water backup occurs in your home","51","","0","What is a sewer backup?","23","What causes sewer backups?","26","index, follow, max-image-preview:large, max-snippet:-1, max-video-preview:-1","","","https://www.squareone.ca/resource-centres/home-personal-safety/after-a-water-backup","","","","","","97286","2616","338","7.740","69.783","Normal","16.686","2","","11","4","0","1.530","55","41","0","9","9","0","","","","","1917d3038f109fd4ee6447203976cc2f","2.518","","","","","1.1","https://www.squareone.ca/resource-centres/home-personal-safety/after-a-water-backup","2023-05-24 14:53:23"
"https://www.squareone.ca/home/alberta/lethbridge","text/html; charset=UTF-8","200","OK","Indexable","","Home Insurance In Lethbridge From $12/Month | Square One","56","542","Buy home insurance in Lethbridge for as little as $12/month. Get a free online home insurance quote in 5 minutes from Square One.","129","808","","0","Lethbridge home insurance from $12/month","40","","0","Get an online home insurance quote in 5 minutes.","48","home insurance customers love and trust","39","index, follow, max-image-preview:large, max-snippet:-1, max-video-preview:-1","","","https://www.squareone.ca/home/alberta/lethbridge","","","","","","86885","1652","258","6.403","80.503","Easy","11.623","2","","2","2","0","0.760","39","33","0","4","4","0","","","","","a6304da09da2cc928811d26958d80747","1.799","","","","","1.1","https://www.squareone.ca/home/alberta/lethbridge","2023-05-24 14:53:25"
"https://www.squareone.ca/resource-centres/home-improvement/best-time-to-buy-appliances-a-guide","text/html; charset=UTF-8","200","OK","Indexable","","Best Times to Buy Home Appliances | Tips, Discounts and More | Square One","73","681","Major appliances can expensive to replace & put a real dent in your savings. Learn the best times of the year to buy home appliances, how to find discounts, when you should consider buying used appliances and tips to help your buying decision.","243","1499","","0","Guide: Best time to buy home appliances","39","","0","The best times in the year to buy appliances","44","How to find discount appliances","31","index, follow, max-image-preview:large, max-snippet:-1, max-video-preview:-1","","","https://www.squareone.ca/resource-centres/home-improvement/best-time-to-buy-appliances-a-guide","","","","","","81577","2088","293","7.126","73.148","Fairly Easy","15.877","2","","14","10","0","3.820","47","37","0","7","7","0","","","","","b02aa75538e0200b2587de751838186","2.919","","","","","1.1","https://www.squareone.ca/resource-centres/home-improvement/best-time-to-buy-appliances-a-guide","2023-05-24 14:53:24"
"https://www.squareone.ca/resource-centres/home-personal-safety/hosting-christmas-parties-safety-and-liability-tips","text/html; charset=UTF-8","200","OK","Indexable","","Hosting Christmas Parties | Safety and Liability Tips | Square One","66","581","The holidays and Christmas time can be a great period to have guests over and host parties. There are many liability considerations you need to be aware of, especially if there is alcohol involved. Learn how you can protect yourself and your guests from any liabilities.","270","1633","","0","Hosting Christmas parties: Safety and liability tips","52","","0","Liability issues around hosting parties","39","What is a social host?","22","index, follow, max-image-preview:large, max-snippet:-1, max-video-preview:-1","","","https://www.squareone.ca/resource-centres/home-personal-safety/hosting-christmas-parties-safety-and-liability-tips","","","","","","71575","1111","159","6.987","67.931","Normal","10.164","2","","12","10","0","3.820","44","36","0","6","6","0","","","","","cbdedf1f3cd402d25bbd979b3a145a4e","1.323","","","","","1.1","https://www.squareone.ca/resource-centres/home-personal-safety/hosting-christmas-parties-safety-and-liability-tips","2023-05-24 14:53:26"
"https://www.squareone.ca/resource-centres/home-improvement/learning-about-house-foundation-types","text/html; charset=UTF-8","200","OK","Indexable","","House Foundations | Types, Costs and FAQs | Square One","54","510","Learn about all the different types of house foundations, their cost per square foot, as well as other characteristics, benefits and risks of each different home foundation type. We'll also review what information about your foundation is important for insurance providers.","273","1652","","0","House foundation types","22","","0","What is a foundation?","21","Types of foundation","19","index, follow, max-image-preview:large, max-snippet:-1, max-video-preview:-1","","","https://www.squareone.ca/resource-centres/home-improvement/learning-about-house-foundation-types","","","","","","92012","2055","255","8.059","71.076","Fairly Easy","14.146","2","","16","12","0","4.580","55","43","0","8","8","0","","","","","489cb270acfd5d4b6d35772e6d18be88","2.877","","","","","1.1","https://www.squareone.ca/resource-centres/home-improvement/learning-about-house-foundation-types","2023-05-24 14:53:25"
"https://www.squareone.ca/sales/download_named_document?file_name=House-owner-wordings.pdf&lang_code=en","application/pdf","200","OK","Indexable","","Microsoft Word - 20220710 EN House Owner Web Sample","51","514","","0","0","","0","","0","","0","","0","","0","","","","","","","","","","0","0","","","","","0.000","2","","6","6","0","2.290","0","0","0","0","0","0","","","","","","0.099","","","","","1.1","https://www.squareone.ca/sales/download_named_document?file_name=House-owner-wordings.pdf&lang_code=en","2023-05-24 14:53:27"
"https://www.squareone.ca/resource-centres/insurance-basics/landslide-or-acts-of-god-damage","text/html; charset=UTF-8","200","OK","Indexable","","Insuring Against Landslide Damage | Protection, Coverage and More | Square One","78","725","Landslides can devastate an area. Learn how you can protect your home and family from landslide damages with certain insurance coverages and other government assisted programs. Also learn what an act of god is and how you can be protected.","239","1532","","0","Is insurance available for landslide damage?","44","","0","What is considered a “landslide?”","33","How fast do landslides move?","28","index, follow, max-image-preview:large, max-snippet:-1, max-video-preview:-1","","","https://www.squareone.ca/resource-centres/insurance-basics/landslide-or-acts-of-god-damage","","","","","","77606","957","147","6.510","58.520","Fairly Hard","8.583","2","","16","12","0","4.580","48","38","0","19","19","0","","","","","621cc2bbb2cf528ed667a303d6587796","2.239","","","","","1.1","https://www.squareone.ca/resource-centres/insurance-basics/landslide-or-acts-of-god-damage","2023-05-24 14:53:26"
"https://www.squareone.ca/sales/images/icons/icon-condo.svg","image/svg+xml","200","OK","Indexable","","","0","0","","0","0","","0","","0","","0","","0","","0","","","","","","","","","","3956","0","","","","","0.000","2","","0","0","0","0.000","0","0","0","0","0","0","","","","","","0.030","Wed, 19 Apr 2023 02:39:37 GMT","","","","1.1","https://www.squareone.ca/sales/images/icons/icon-condo.svg","2023-05-24 14:53:28"
"https://www.squareone.ca/about-us/team-members","text/html; charset=UTF-8","200","OK","Indexable","","Team Members | Square One","25","261","Learn about Square One’s team members and how they bring a wide range of experience from the insurance, banking, and software industries.","137","879","","0","Meet the Square One team","24","","0","Aneel Mattu","11","Annie Zhang","11","index, follow, max-image-preview:large, max-snippet:-1, max-video-preview:-1","","","https://www.squareone.ca/about-us/team-members","","","","","","170170","9624","1544","6.233","52.617","Fairly Hard","37.020","2","","2","2","0","0.760","27","24","0","53","34","0","","","","","613bbe5f3b4bee63ac808f877892e2f7","1.314","","","","","1.1","https://www.squareone.ca/about-us/team-members","2023-05-24 14:53:27"
"https://www.squareone.ca/home/all-risk","text/html; charset=UTF-8","200","OK","Indexable","","All-Risk Home Insurance from $12/Month | Square One","51","487","For as little as $12/month, you can get all-risk home insurance from Square One. Get an online quote in 5 minutes or call 1.855.331.6933 to speak with a licensed agent.","168","1032","","0","all-risk insurance from $12/month","33","","0","Get an online all-risk insurance quote in 5 minutes.","52","all-risk insurance customers love and trust","43","index, follow, max-image-preview:large, max-snippet:-1, max-video-preview:-1","","","https://www.squareone.ca/home/all-risk","","","","","","86933","1668","268","6.224","81.124","Easy","11.778","2","","3","3","0","1.150","36","31","0","4","4","0","","","","","7448fd4b070977b1adbb8281720a4a19","1.790","","","","","1.1","https://www.squareone.ca/home/all-risk","2023-05-24 14:53:27"
"https://www.squareone.ca/sales/ionic/css/app.3914361d.css","text/css","200","OK","Indexable","","","0","0","","0","0","","0","","0","","0","","0","","0","","","","","","","","","","47911","0","","","","","0.000","2","","0","0","0","0.000","0","0","0","0","0","0","","","","","","0.118","Wed, 19 Apr 2023 02:39:48 GMT","","","","1.1","https://www.squareone.ca/sales/ionic/css/app.3914361d.css","2023-05-24 14:53:29"
"https://www.squareone.ca/home/log","text/html; charset=UTF-8","200","OK","Indexable","","Log Home Insurance | Square One","31","303","For about $75/month, you can get log home insurance from Square One. Get a free online quote now or call 1.855.331.6933.","120","768","","0","Get a log home insurance quote in 5 minutes","43","","0","Log home insurance that customers love and trust","48","Six reasons why you'll love Square One","38","index, follow, max-image-preview:large, max-snippet:-1, max-video-preview:-1","","","https://www.squareone.ca/home/log","","","","","","98548","2840","435","6.529","67.291","Normal","18.373","2","","4","3","0","1.150","42","37","0","4","4","0","","","","","caa8cfae784ae020757bc38e285f2a45","2.667","","","","","1.1","https://www.squareone.ca/home/log","2023-05-24 14:53:27"
"https://www.squareone.ca/resource-centres/home-personal-safety/ice-dams-and-your-roof","text/html; charset=UTF-8","200","OK","Indexable","","Ice Dams and Roofs | What It Is, Avoidance, Insurance and More | Square One","75","682","An ice dam is not something that forms in a river; it's something that forms on your roof. Learn what causes ice dams, how to prevent them, reduce potential damages and how home insurance can protect you.","204","1285","","0","Ice dams and your roof","22","","0","What are ice dams?","18","Damage prevention","17","index, follow, max-image-preview:large, max-snippet:-1, max-video-preview:-1","","","https://www.squareone.ca/resource-centres/home-personal-safety/ice-dams-and-your-roof","","","","","","77989","1319","168","7.851","84.762","Easy","10.206","2","","5","3","0","1.150","49","41","0","5","5","0","","","","","92f17f695caea5dee82acc0fb880db93","1.056","","","","","1.1","https://www.squareone.ca/resource-centres/home-personal-safety/ice-dams-and-your-roof","2023-05-24 14:53:29"
"https://www.squareone.ca/home/legal-protection","text/html; charset=UTF-8","200","OK","Indexable","","Legal Protection Insurance For $5.25/month | Square One","55","512","For as little as $5.25/month, you can get legal protection insurance from Square One. Get a free online quote now or call 1.855.331.6933.","137","844","","0","Legal protection insurance","26","","0","What does legal protection insurance cover?","43","What does landlord legal protection insurance cover?","52","index, follow, max-image-preview:large, max-snippet:-1, max-video-preview:-1","","","https://www.squareone.ca/home/legal-protection","","","","","","88396","2420","360","6.722","72.518","Fairly Easy","16.819","2","","8","8","0","3.050","34","30","0","6","6","0","","","","","81f270b7eb7ed547436922ced243deba","1.506","","","","","1.1","https://www.squareone.ca/home/legal-protection","2023-05-24 14:53:29"
"https://www.squareone.ca/resource-centres/home-improvement/choosing-energy-efficient-appliances-a-quick-guide","text/html; charset=UTF-8","200","OK","Indexable","","[Guide] How to Choose Energy Efficient Appliances | Square One","62","568","With climate change and concerns about non-renewable resources on the minds of many Canadians, it follows that homeowners are interested in saving energy wherever possible. Purchasing energy-efficient appliances is an easy way to cut back on energy use and save money at the same time.","285","1813","","0","Guide: Choosing energy-efficient appliances","43","","0","Canadians and household energy use","34","Ready-made solution","19","index, follow, max-image-preview:large, max-snippet:-1, max-video-preview:-1","","","https://www.squareone.ca/resource-centres/home-improvement/choosing-energy-efficient-appliances-a-quick-guide","","","","","","67054","927","123","7.537","60.376","Normal","9.583","2","","8","5","0","1.910","46","36","0","7","7","0","","","","","df22aed50c43938470631f57ea13bbdd","1.328","","","","","1.1","https://www.squareone.ca/resource-centres/home-improvement/choosing-energy-efficient-appliances-a-quick-guide","2023-05-24 14:53:29"
"https://www.squareone.ca/resource-centres/home-personal-safety/preventing-household-fires","text/html; charset=UTF-8","200","OK","Indexable","","Preventing Household Fires | Candles, Kitchen and Dryer Fires | Square One","74","668","Learn about the safety precautions you can take to prevent a household fire. Including tips for candle, kitchen, dryer and light fires so you can protect your home, belongings and family.","187","1132","","0","How to prevent common household fires","37","","0","General tips to reduce household fires","38","Smoking material fires","22","index, follow, max-image-preview:large, max-snippet:-1, max-video-preview:-1","","","https://www.squareone.ca/resource-centres/home-personal-safety/preventing-household-fires","","","","","","82955","1959","264","7.420","79.378","Fairly Easy","14.194","2","","25","16","0","6.110","52","38","0","9","9","0","","","","","72490ab2247f341c77a6c34372e5e553","1.251","","","","","1.1","https://www.squareone.ca/resource-centres/home-personal-safety/preventing-household-fires","2023-05-24 14:53:30"
"https://www.squareone.ca/resource-centres/home-improvement/furnace-short-cycling-causes-and-troubleshooting","text/html; charset=UTF-8","200","OK","Indexable","","Furnace Short-Cycling? Causes and Troubleshooting | Square One","62","582","A short-cycling furnace can be hard to find the troubleshoot. To help you, here are 5 potential causes for short-cycling furnaces that you can try to fix without a professional.","177","1061","","0","Furnace short-cycling? Causes and troubleshooting","49","","0","What is furnace short-cycling?","30","5 potential causes of short-cycling (with solutions)","52","index, follow, max-image-preview:large, max-snippet:-1, max-video-preview:-1","","","https://www.squareone.ca/resource-centres/home-improvement/furnace-short-cycling-causes-and-troubleshooting","","","","","","84588","1652","229","7.214","78.195","Fairly Easy","12.216","2","","22","10","0","3.820","55","36","0","6","6","0","","","","","270b7a1eace1b63d126f3a70c45610f8","2.040","","","","","1.1","https://www.squareone.ca/resource-centres/home-improvement/furnace-short-cycling-causes-and-troubleshooting","2023-05-24 14:53:29"
"https://www.squareone.ca/condo/bc","text/html; charset=UTF-8","200","OK","Indexable","","Condo Insurance In BC For About $40/Month | Square One","54","514","Buy condo insurance in BC from $40/month. Get a free online condo insurance quote in 5 minutes from Square One.","111","714","","0","BC condo insurance for about $40/month","38","","0","Get an online condo insurance quote in 5 minutes.","49","condo insurance customers love and trust","40","index, follow, max-image-preview:large, max-snippet:-1, max-video-preview:-1","","","https://www.squareone.ca/condo/bc","","","","","","87797","1693","272","6.224","80.688","Easy","11.822","2","","2","2","0","0.760","36","31","0","4","4","0","","","","","77ba8d8b562bf39ff3847c7702a9ae50","2.290","","","","","1.1","https://www.squareone.ca/condo/bc","2023-05-24 14:53:29"
"https://www.squareone.ca/resource-centres/home-personal-safety/securing-your-identity","text/html; charset=UTF-8","200","OK","Indexable","","Identity Theft | Prevention, Recovery, Insurance, and More | Square One","71","629","Identity theft and fraud can be devastating. Learn how you can prevent it from happening to you and how you can recover if it does. Also learn how you can be protected with the right home insurance and identity theft coverage.","226","1399","","0","Securing your identity and smartphone","37","","0","How can your identity can be stolen?","36","How to protect yourself","23","index, follow, max-image-preview:large, max-snippet:-1, max-video-preview:-1","","","https://www.squareone.ca/resource-centres/home-personal-safety/securing-your-identity","","","","","","69594","1255","173","7.254","78.605","Fairly Easy","11.110","2","","7","4","0","1.530","45","36","0","6","6","0","","","","","a007f999661ef5b52cf3263a191e8af6","1.171","","","","","1.1","https://www.squareone.ca/resource-centres/home-personal-safety/securing-your-identity","2023-05-24 14:53:31"
"https://www.squareone.ca/home/alberta/calgary","text/html; charset=UTF-8","200","OK","Indexable","","Home Insurance In Calgary From $12/Month | Square One","53","513","Buy home insurance in Calgary for as little as $12/month. Get a free online home insurance quote in 5 minutes from Square One.","126","789","","0","Calgary home insurance from $12/month","37","","0","Get an online home insurance quote in 5 minutes.","48","home insurance customers love and trust","39","index, follow, max-image-preview:large, max-snippet:-1, max-video-preview:-1","","","https://www.squareone.ca/home/alberta/calgary","","","","","","109937","2970","449","6.615","75.813","Fairly Easy","16.281","2","","8","3","0","1.150","47","35","0","30","30","0","","","","","883437dacab6e1985356bcd258e97468","1.589","","","","","1.1","https://www.squareone.ca/home/alberta/calgary","2023-05-24 14:53:31"
"https://www.squareone.ca/sales/images/icons/icon-tool.svg","image/svg+xml","200","OK","Indexable","","","0","0","","0","0","","0","","0","","0","","0","","0","","","","","","","","","","1402","0","","","","","0.000","2","","0","0","0","0.000","0","0","0","0","0","0","","","","","","0.027","Wed, 19 Apr 2023 02:39:40 GMT","","","","1.1","https://www.squareone.ca/sales/images/icons/icon-tool.svg","2023-05-24 14:53:33"
"https://www.squareone.ca/resource-centres/home-improvement/closing-your-vacation-property","text/html; charset=UTF-8","200","OK","Indexable","","Closing Your Vacation Property [16 Tips and Insurance Info] | Square One","72","645","If you own a vacation property or second home that you don’t use during the winter, there are a few things to think about before you shut it down for the season. Follow this checklist so you can return next season without an unexpected surprise.","245","1507","","0","Closing your vacation property for the season","45","","0","16 tips for closing your vacation property","42","Prepare a separate home inventory","33","index, follow, max-image-preview:large, max-snippet:-1, max-video-preview:-1","","","https://www.squareone.ca/resource-centres/home-improvement/closing-your-vacation-property","","","","","","68909","1115","151","7.384","78.320","Fairly Easy","10.201","2","","12","10","0","3.820","48","39","0","5","5","0","","","","","53cfe3121eadde12a11860a044c86a95","2.438","","","","","1.1","https://www.squareone.ca/resource-centres/home-improvement/closing-your-vacation-property","2023-05-24 14:53:31"
