"https://www.squareone.ca/resource-centres/home-personal-safety/a-home-fire-is-your-family-prepared","text/html; charset=UTF-8","200","OK","Indexable","","How To Prepare Your Family For a Home Fire | Square One","55","521","In the event of a home fire, you and your family will want to be prepared for how you'll deal with the situation. Learn how to prepare a family evacuation plan, best practices and how to set up a smoke detector.","211","1279","","0","How to prepare your family for a fire","37","","0","Setting up a home smoke detector","32","Make a home fire evacuation map","31","index, follow, max-image-preview:large, max-snippet:-1, max-video-preview:-1","","","https://www.squareone.ca/resource-centres/home-personal-safety/a-home-fire-is-your-family-prepared","","","","","","79476","1120","146","7.671","80.382","Easy","8.758","2","","12","9","0","3.440","46","35","0","6","6","0","","","","","a2d25f45446d5efeeda28b50cf821b0e","1.508","","","","","1.1","https://www.squareone.ca/resource-centres/home-personal-safety/a-home-fire-is-your-family-prepared","2023-05-24 14:52:57"
"https://www.squareone.ca/sales/images/icons/icon-claim.svg","image/svg+xml","200","OK","Indexable","","","0","0","","0","0","","0","","0","","0","","0","","0","","","","","","","","","","1526","0","","","","","0.000","2","","0","0","0","0.000","0","0","0","0","0","0","","","","","","0.025","Wed, 19 Apr 2023 02:39:39 GMT","","","","1.1","https://www.squareone.ca/sales/images/icons/icon-claim.svg","2023-05-24 14:52:59"
"https://www.squareone.ca/tenant/bc/coquitlam","text/html; charset=UTF-8","200","OK","Indexable","","Tenant Insurance In Coquitlam From $12/Month | Square One","57","547","Buy tenant and renters insurance in Coquitlam for as little as $12/month. Get a free online tenant insurance quote in 5 minutes from Square One.","144","891","","0","Coquitlam tenant insurance from $12/month","41","","0","Get an online tenant insurance quote in 5 minutes.","50","tenant insurance customers love and trust","41","index, follow, max-image-preview:large, max-snippet:-1, max-video-preview:-1","","","https://www.squareone.ca/tenant/bc/coquitlam","","","","","","88299","1722","272","6.331","80.633","Easy","11.939","2","","2","2","0","0.760","36","31","0","4","4","0","","","","","d29f5da91c42639d50db3ed93223e8d1","1.776","","","","","1.1","https://www.squareone.ca/tenant/bc/coquitlam","2023-05-24 14:52:57"
"https://www.squareone.ca/tenant/alberta/calgary","text/html; charset=UTF-8","200","OK","Indexable","","Tenant Insurance In Calgary From $12/Month | Square One","55","522","Buy tenant and renters insurance in Calgary for as little as $12/month. Get a free online tenant insurance quote in 5 minutes from Square One.","142","875","","0","Calgary tenant insurance from $12/month","39","","0","Get an online tenant insurance quote in 5 minutes.","50","tenant insurance customers love and trust","41","index, follow, max-image-preview:large, max-snippet:-1, max-video-preview:-1","","","https://www.squareone.ca/tenant/alberta/calgary","","","","","","88259","1716","272","6.309","80.434","Easy","11.916","2","","2","2","0","0.760","36","31","0","4","4","0","","","","","e9b6325e6f2372ede40098c26459efc6","2.077","","","","","1.1","https://www.squareone.ca/tenant/alberta/calgary","2023-05-24 14:52:57"
"https://www.squareone.ca/sales/","text/html; charset=utf-8","302","Found","Non-Indexable","Redirected","","0","0","","0","0","","0","","0","","0","","0","","0","","","","","","","","","","112","0","","","","","0.000","2","","0","0","0","0.000","0","0","0","0","0","0","","","","","","0.152","","https://www.squareone.ca/?login=true&url=%2Fsales%2Faccount","HTTP Redirect","","1.1","https://www.squareone.ca/sales/","2023-05-24 14:52:59"
"https://www.squareone.ca/home/alberta/grand-prairie","text/html; charset=UTF-8","200","OK","Indexable","","Home Insurance In Grand Prairie From $12/Month | Square One","59","564","Buy home insurance in Grand Prairie for as little as $12/month. Get a free online home insurance quote in 5 minutes from Square One.","132","823","","0","Grand Prairie home insurance from $12/month","43","","0","Get an online home insurance quote in 5 minutes.","48","home insurance customers love and trust","39","index, follow, max-image-preview:large, max-snippet:-1, max-video-preview:-1","","","https://www.squareone.ca/home/alberta/grand-prairie","","","","","","86962","1654","259","6.386","80.665","Easy","11.620","2","","2","2","0","0.760","39","33","0","4","4","0","","","","","fe58e03107ba032045c8963f2bf8cc15","1.731","","","","","1.1","https://www.squareone.ca/home/alberta/grand-prairie","2023-05-24 14:52:58"
"https://www.squareone.ca/resource-centres/condo-owner/condo-fees","text/html; charset=UTF-8","200","OK","Indexable","","Condo Fee Guide | Definition, Average Rates, and Examples | Square One","70","645","Learn all about condo fees (a.k.a. strata fees), including what they are and what they usually cover, from insurance to reserve funds.","134","815","","0","Condo fee guide","15","","0","What are condo fees?","20","What do condo fees cover?","25","index, follow, max-image-preview:large, max-snippet:-1, max-video-preview:-1","","","https://www.squareone.ca/resource-centres/condo-owner/condo-fees","","","","","","73229","1315","180","7.306","68.370","Normal","11.721","2","","16","11","0","4.200","44","34","0","10","8","0","","","","","edd4d1d7f445797a084e32bd9e2fded1","1.403","","","","","1.1","https://www.squareone.ca/resource-centres/condo-owner/condo-fees","2023-05-24 14:52:59"
"https://www.squareone.ca/careers/remote-damage-insurance-agent","text/html; charset=UTF-8","200","OK","Indexable","","Remote Damage Insurance Agent | Square One","42","419","Learn about the remote damage insurance agent role that Square One is currently looking to fill.","96","589","","0","Damage Insurance Agent (AMF license)","36","","0","Your role","9","Your responsibilities","21","index, follow, max-image-preview:large, max-snippet:-1, max-video-preview:-1","","","https://www.squareone.ca/careers/remote-damage-insurance-agent","","","","","","57533","843","108","7.806","71.360","Fairly Easy","9.998","2","","1","1","0","0.380","29","24","0","4","4","0","","","","","c281a3f9a7841a2a742083d20bfe37cf","1.390","","","","","1.1","https://www.squareone.ca/careers/remote-damage-insurance-agent","2023-05-24 14:52:59"
"https://www.squareone.ca/rental-portal","text/html; charset=UTF-8","200","OK","Indexable","","Rental Portal | Square One","26","235","A free tool for property managers and landlords to have full insight into the status of their tenants' insurance policies.","122","720","","0","Rental Portal from Square One","29","","0","Stay informed about your tenants’ home insurance status","55","Effortlessly refer new and existing tenants for insurance","57","index, follow, max-image-preview:large, max-snippet:-1, max-video-preview:-1","","","https://www.squareone.ca/rental-portal","","","","","","53021","548","66","8.303","68.729","Normal","7.387","2","","7","4","0","1.530","31","25","0","5","5","0","","","","","8d7e9e667a240f764fe613f5cbfb7318","1.139","","","","","1.1","https://www.squareone.ca/rental-portal","2023-05-24 14:52:59"
"https://www.squareone.ca/tenant/bc/richmond","text/html; charset=UTF-8","200","OK","Indexable","","Tenant Insurance In Richmond From $12/Month | Square One","56","544","Buy tenant and renters insurance in Richmond for as little as $12/month. Get a free online tenant insurance quote in 5 minutes from Square One.","143","890","","0","Richmond tenant insurance from $12/month","40","","0","Get an online tenant insurance quote in 5 minutes.","50","tenant insurance customers love and trust","41","index, follow, max-image-preview:large, max-snippet:-1, max-video-preview:-1","","","https://www.squareone.ca/tenant/bc/richmond","","","","","","88287","1722","272","6.331","80.731","Easy","11.938","2","","2","2","0","0.760","36","31","0","4","4","0","","","","","97b32f76ae8563cc1038fd6e4fc039aa","1.681","","","","","1.1","https://www.squareone.ca/tenant/bc/richmond","2023-05-24 14:52:59"
"https://www.squareone.ca/resource-centres/home-personal-safety/snow-removal-this-winter","text/html; charset=UTF-8","200","OK","Indexable","","Winter snow removal across Canada - Square One","46","446","It is that time of year when most of Canada is covered with a blanket of white snow. Many adults cringe at the additional chores that come with snowfall.","153","942","","0","Winter snow removal across Canada","33","","0","Read related articles","21","Get a free quote","16","index, follow, max-image-preview:large, max-snippet:-1, max-video-preview:-1","","","https://www.squareone.ca/resource-centres/home-personal-safety/snow-removal-this-winter","","","","","","55285","342","44","7.773","74.272","Fairly Easy","4.879","2","","1","1","0","0.380","37","31","0","5","5","0","","","","","730539b15c8ab2917d1dac947719c8a2","1.051","","","","","1.1","https://www.squareone.ca/resource-centres/home-personal-safety/snow-removal-this-winter","2023-05-24 14:53:01"
"https://www.squareone.ca/sales/images/illustrations/illustration-suburbs-neighbourhood.png","image/png","200","OK","Indexable","","","0","0","","0","0","","0","","0","","0","","0","","0","","","","","","","","","","18612","0","","","","","0.000","2","","0","0","0","0.000","0","0","0","0","0","0","","","","","","0.029","Wed, 19 Apr 2023 02:39:52 GMT","","","","1.1","https://www.squareone.ca/sales/images/illustrations/illustration-suburbs-neighbourhood.png","2023-05-24 14:53:02"
"https://www.squareone.ca/home/bc/new-westminster","text/html; charset=UTF-8","200","OK","Indexable","","Home Insurance In New Westminster From $12/Month | Square One","61","606","Buy home insurance in New Westminster for as little as $12/month. Get a free online home insurance quote in 5 minutes from Square One.","134","850","","0","New Westminster home insurance from $12/month","45","","0","Get an online home insurance quote in 5 minutes.","48","home insurance customers love and trust","39","index, follow, max-image-preview:large, max-snippet:-1, max-video-preview:-1","","","https://www.squareone.ca/home/bc/new-westminster","","","","","","87466","1675","264","6.345","79.430","Fairly Easy","11.866","2","","2","2","0","0.760","39","33","0","4","4","0","","","","","9a84221d93481aafed13506bd1406fc8","1.560","","","","","1.1","https://www.squareone.ca/home/bc/new-westminster","2023-05-24 14:53:01"
"https://www.squareone.ca/resource-centres/home-improvement/hvac-troubleshooting-and-maintenance-tips","text/html; charset=UTF-8","200","OK","Indexable","","Home HVAC Systems | Basics, Maintenance and Pest Removal | Square One","69","678","An HVAC system is an important part of any home and it needs regular maintenance to run smoothly. Well maintained HVAC's should last for 10 years or so. Learn how to maintain the HVAC system, how to avoid pests from entering the system and other important information.","268","1704","","0","Home HVAC systems: Basics, maintenance and pest removal","55","","0","The value of HVAC maintenance","29","Maintenance tasks","17","index, follow, max-image-preview:large, max-snippet:-1, max-video-preview:-1","","","https://www.squareone.ca/resource-centres/home-improvement/hvac-troubleshooting-and-maintenance-tips","","","","","","84256","2116","282","7.504","75.997","Fairly Easy","15.464","2","","21","14","0","5.340","49","38","0","4","4","0","","","","","969099c249267314d1c293ddf930a59a","1.654","","","","","1.1","https://www.squareone.ca/resource-centres/home-improvement/hvac-troubleshooting-and-maintenance-tips","2023-05-24 14:53:01"
"https://www.squareone.ca/home/bc/saanich","text/html; charset=UTF-8","200","OK","Indexable","","Home Insurance In Saanich From $12/Month | Square One","53","517","Buy home insurance in Saanich for as little as $12/month. Get a free online home insurance quote in 5 minutes from Square One.","126","791","","0","Saanich home insurance from $12/month","37","","0","Get an online home insurance quote in 5 minutes.","48","home insurance customers love and trust","39","index, follow, max-image-preview:large, max-snippet:-1, max-video-preview:-1","","","https://www.squareone.ca/home/bc/saanich","","","","","","87254","1672","264","6.333","79.528","Fairly Easy","11.867","2","","2","2","0","0.760","39","33","0","4","4","0","","","","","9a2728e2620e1bb838d7105a7d116e53","1.925","","","","","1.1","https://www.squareone.ca/home/bc/saanich","2023-05-24 14:53:00"
"https://www.squareone.ca/house/knob-tube-wiring","text/html; charset=UTF-8","200","OK","Indexable","","Insurance for Homes With Knob and Tube Wiring | Square One","58","552","For about $75/month, you can get insurance for your home with knob and tube wiring. Get a free online quote now or call 1.855.331.6933.","135","853","","0","Insurance for houses with knob and tube wiring","46","","0","Get an online house insurance quote in 5 minutes.","49","house insurance customers love and trust","40","index, follow, max-image-preview:large, max-snippet:-1, max-video-preview:-1","","","https://www.squareone.ca/house/knob-tube-wiring","","","","","","87894","1663","266","6.252","80.737","Easy","11.648","2","","3","3","0","1.150","36","31","0","4","4","0","","","","","3e7a583d6c7f4b1bc24aee5d0a0d64e9","1.812","","","","","1.1","https://www.squareone.ca/house/knob-tube-wiring","2023-05-24 14:53:01"
"https://www.squareone.ca/resource-centres/insurance-basics/frozen-pipes-dont-have-to-spell-disaster","text/html; charset=UTF-8","200","OK","Indexable","","Frozen Pipes and Insurance | Coverage, Exclusions and More | Square One","71","657","Frozen pipes can cause major disasters for your home. If you don’t have the proper insurance policy, you could be limited in the type of coverage you have. Learn how you can avoid trouble with frozen pipes and what type of insurance policy you need to be properly protected.","274","1687","","0","Frozen pipes and your home insurance","36","","0","How to prevent your pipes from freezing","39","Does home insurance cover damage from frozen pipes?","51","index, follow, max-image-preview:large, max-snippet:-1, max-video-preview:-1","","","https://www.squareone.ca/resource-centres/insurance-basics/frozen-pipes-dont-have-to-spell-disaster","","","","","","77937","1455","174","8.362","70.488","Fairly Easy","11.914","2","","22","18","0","6.870","50","40","0","5","5","0","","","","","39fab29e801a4fd467b5dc683c3b1220","1.117","","","","","1.1","https://www.squareone.ca/resource-centres/insurance-basics/frozen-pipes-dont-have-to-spell-disaster","2023-05-24 14:53:03"
"https://www.squareone.ca/sales/images/illustrations/illustration-working-at-computer-shadow.png","image/png","200","OK","Indexable","","","0","0","","0","0","","0","","0","","0","","0","","0","","","","","","","","","","8107","0","","","","","0.000","2","","0","0","0","0.000","0","0","0","0","0","0","","","","","","0.028","Wed, 19 Apr 2023 02:39:53 GMT","","","","1.1","https://www.squareone.ca/sales/images/illustrations/illustration-working-at-computer-shadow.png","2023-05-24 14:53:04"
"https://www.squareone.ca/home/heritage","text/html; charset=UTF-8","200","OK","Indexable","","Heritage Home Insurance For About $75/Month | Square One","56","542","For about $75/month, you can get heritage home insurance from Square One. Get an online quote in 5 minutes or call 1.855.331.6933 to speak with a licensed agent.","161","1018","","0","Heritage home insurance for about $75/month","43","","0","Get an online heritage home insurance quote in 5 minutes.","57","heritage home insurance customers love and trust","48","index, follow, max-image-preview:large, max-snippet:-1, max-video-preview:-1","","","https://www.squareone.ca/home/heritage","","","","","","89098","1680","268","6.269","80.320","Easy","11.605","2","","4","4","0","1.530","36","31","0","4","4","0","","","","","fb1ee83be235c8dd07b5876325e2dc2b","1.460","","","","","1.1","https://www.squareone.ca/home/heritage","2023-05-24 14:53:02"
"https://www.squareone.ca/resource-centres/home-personal-safety/prevent-ski-and-snowboard-equipment-theft","text/html; charset=UTF-8","200","OK","Indexable","","How To Prevent Ski and Snowboard Equipment Theft | Square One","61","591","Snowboard and ski equipment can cost thousands of dollars. Learn how to protect these belongings while on the mountain, and what you need to do if your skis or snowboard is stolen.","180","1136","","0","How to prevent ski and snowboard equipment theft on the slopes","62","","0","Lock your ski equipment","23","Check your snowboard and skis","29","index, follow, max-image-preview:large, max-snippet:-1, max-video-preview:-1","","","https://www.squareone.ca/resource-centres/home-personal-safety/prevent-ski-and-snowboard-equipment-theft","","","","","","68836","1014","137","7.401","78.346","Fairly Easy","9.403","2","","14","9","0","3.440","44","33","0","6","6","0","","","","","ceb96a723b0942ab9d512ad382599415","1.319","","","","","1.1","https://www.squareone.ca/resource-centres/home-personal-safety/prevent-ski-and-snowboard-equipment-theft","2023-05-24 14:53:03"
"https://www.squareone.ca/home/bc/surrey","text/html; charset=UTF-8","200","OK","Indexable","","Home Insurance In Surrey From $12/Month | Square One","52","503","Buy home insurance in Surrey for as little as $12/month. Get a free online home insurance quote in 5 minutes from Square One.","125","781","","0","Surrey home insurance from $12/month","36","","0","Get an online home insurance quote in 5 minutes.","48","home insurance customers love and trust","39","index, follow, max-image-preview:large, max-snippet:-1, max-video-preview:-1","","","https://www.squareone.ca/home/bc/surrey","","","","","","88328","1672","264","6.333","79.528","Fairly Easy","11.720","2","","2","2","0","0.760","39","33","0","4","4","0","","","","","670a9bafa6c66414fb48eda6e39b6d1","1.406","","","","","1.1","https://www.squareone.ca/home/bc/surrey","2023-05-24 14:53:03"
"https://www.squareone.ca/tenant/bc/langley","text/html; charset=UTF-8","200","OK","Indexable","","Tenant Insurance In Langley From $12/Month | Square One","55","524","Buy tenant and renters insurance in Langley for as little as $12/month. Get a free online tenant insurance quote in 5 minutes from Square One.","142","876","","0","Langley tenant insurance from $12/month","39","","0","Get an online tenant insurance quote in 5 minutes.","50","tenant insurance customers love and trust","41","index, follow, max-image-preview:large, max-snippet:-1, max-video-preview:-1","","","https://www.squareone.ca/tenant/bc/langley","","","","","","88239","1722","272","6.331","80.731","Easy","11.943","2","","2","2","0","0.760","36","31","0","4","4","0","","","","","9ef4cbb7b48650df618f9092e1453511","1.609","","","","","1.1","https://www.squareone.ca/tenant/bc/langley","2023-05-24 14:53:03"
"https://www.squareone.ca/makeover","text/html; charset=UTF-8","200","OK","Indexable","","The Room Makeover Series | Square One","37","364","Presented by Square One, each episode in The Room Makeover Series features a deserving family getting one room redesigned and renovated in just 48 hours. See the thought process behind the redesign, hidden issues that arise during renovations, and amazing before and after transitions.","285","1785","","0","The Room Makeover Series","24","","0","Episode 3: Gabrielle","20","Episode 2: Kaela and Matthew","28","index, follow, max-image-preview:large, max-snippet:-1, max-video-preview:-1","","","https://www.squareone.ca/makeover","","","","","","55105","520","74","7.027","62.878","Normal","7.185","2","","5","2","0","0.760","31","25","0","15","11","0","","","","","8f785aa07cbcb34c171174a1a74771d2","0.791","","","","","1.1","https://www.squareone.ca/makeover","2023-05-24 14:53:04"
"https://www.squareone.ca/resource-centres/home-improvement/habits-that-shorten-the-life-of-your-washer-and-dryer","text/html; charset=UTF-8","200","OK","Indexable","","Habits That Shorten The Lifespan of Your Washer And Dryer | Square One","70","653","Washer and dryers are an expensive purchase when you’re a homeowner and you’ll want to use these appliances for as long as possible. Follow these tips and habits to make sure your washer and dryer can run smoothly for the long-term.","232","1462","","0","Habits that shorten the life of your washer and dryer","53","","0","General advice","14","Washer wear n’ tear: handy tips for washer longevity","52","index, follow, max-image-preview:large, max-snippet:-1, max-video-preview:-1","","","https://www.squareone.ca/resource-centres/home-improvement/habits-that-shorten-the-life-of-your-washer-and-dryer","","","","","","72049","1152","166","6.940","80.602","Easy","10.178","2","","17","15","0","5.730","45","37","0","7","7","0","","","","","41732d791c0d8d5aa2032ec4460825bf","1.048","","","","","1.1","https://www.squareone.ca/resource-centres/home-improvement/habits-that-shorten-the-life-of-your-washer-and-dryer","2023-05-24 14:53:04"
"https://www.squareone.ca/resource-centres/condo-owner/bill-141","text/html; charset=UTF-8","200","OK","Indexable","","Bill 141 in Quebec | Impact on Condo Owners | Square One","56","517","Learn about Quebec's Bill 141, which impacts syndicates and co-owners in Quebec, including what's inside the bill and what condo owners need to do.","147","921","","0","Getting to know Quebec’s Bill 141","33","","0","What is Bill 141?","17","What’s in the law?","18","index, follow, max-image-preview:large, max-snippet:-1, max-video-preview:-1","","","https://www.squareone.ca/resource-centres/condo-owner/bill-141","","","","","","73344","1243","172","7.227","75.765","Fairly Easy","10.952","2","","9","2","0","0.760","48","35","0","7","7","0","","","","","a690c895a3a41a9ea3220ab71bf88f3f","0.787","","","","","1.1","https://www.squareone.ca/resource-centres/condo-owner/bill-141","2023-05-24 14:53:04"
"https://www.squareone.ca/cancelling-a-policy","text/html; charset=UTF-8","200","OK","Indexable","","Cancelling a Policy | Square One","32","286","Learn how to can cancel your policy and what you expect during the process. Also, read how Square One can solve your most common concerns.","138","893","","0","Cancelling your policy","22","","0","“I found a cheaper policy”","26","“I’ve decided to move”","22","index, follow, max-image-preview:large, max-snippet:-1, max-video-preview:-1","","","https://www.squareone.ca/cancelling-a-policy","","","","","","52943","833","108","7.713","66.571","Normal","10.855","2","","3","3","0","1.150","27","24","0","5","5","0","","","","","ef09dac3b5ea8caf3c3694607e9f6082","0.890","","","","","1.1","https://www.squareone.ca/cancelling-a-policy","2023-05-24 14:53:05"
"https://www.squareone.ca/resource-centres/home-improvement/winterizing-your-home","text/html; charset=UTF-8","200","OK","Indexable","","[Guide] Winterizing Your Home | Pipes, Heat, Sidewalks and More | Square One","76","697","Your home should always be properly protected from the elements during the winter months. Here are some easy tips you can get started with that will help prevent pipes from freezing, heat from leaking and keeping others safe on the sidewalks.","242","1503","","0","How to winterize your home","26","","0","How to properly winterize your home","35","Keeping your sidewalks safe","27","index, follow, max-image-preview:large, max-snippet:-1, max-video-preview:-1","","","https://www.squareone.ca/resource-centres/home-improvement/winterizing-your-home","","","","","","85622","1952","258","7.566","76.893","Fairly Easy","13.989","2","","12","10","0","3.820","52","44","0","6","6","0","","","","","6c46d72621579697eccdc5e595784049","0.791","","","","","1.1","https://www.squareone.ca/resource-centres/home-improvement/winterizing-your-home","2023-05-24 14:53:05"
"https://www.squareone.ca/home/dwelling","text/html; charset=UTF-8","200","OK","Indexable","","Dwelling Insurance From $12/Month | Square One","46","442","For as little as $12/month, you can get personalized dwelling insurance from Square One. Get an online quote in 5 minutes or call 1.855.331.6933 to speak with a licensed agent.","176","1087","","0","dwelling insurance from $12/month","33","","0","Get an online dwelling insurance quote in 5 minutes.","52","dwelling insurance customers love and trust","43","index, follow, max-image-preview:large, max-snippet:-1, max-video-preview:-1","","","https://www.squareone.ca/home/dwelling","","","","","","86923","1668","268","6.224","81.124","Easy","11.780","2","","3","3","0","1.150","36","31","0","4","4","0","","","","","d9645ca3f1e8434ee89cb25134bb6b86","1.626","","","","","1.1","https://www.squareone.ca/home/dwelling","2023-05-24 14:53:04"
"https://www.squareone.ca/resource-centres/insurance-basics/water-damage","text/html; charset=UTF-8","200","OK","Indexable","","Insuring Against Water Damage | Coverage, Prevention and More | Square One","74","697","Water damage is a major cause of losses to homes and personal property. Learn what kind of insurance coverage you need to be properly protected, along with 10 tips on how to prevent water damage before it happens.","213","1349","","0","Is insurance available for water damage?","40","","0","The typical approach: home insurance and water damage","53","How does Square One cover water damage?","39","index, follow, max-image-preview:large, max-snippet:-1, max-video-preview:-1","","","https://www.squareone.ca/resource-centres/insurance-basics/water-damage","","","","","","76646","1542","202","7.634","60.611","Normal","13.181","2","","11","9","0","3.440","52","42","0","5","5","0","","","","","153b806c431479d81dc1a35e210d4832","1.021","","","","","1.1","https://www.squareone.ca/resource-centres/insurance-basics/water-damage","2023-05-24 14:53:05"
